{
  "userKey": "7dfb9ded-c38f-49ae-95e2-307283a0b1f6",
  "returnUrl": "https://authologic.com/tests/return/?conversation={conversationId}",
  "callback": "https://system.acme.test/private/identity/{conversationId}/callback",
  "query": {
    "identity": {
      "requireOneOf": [["PERSON_CONTACT_EMAIL", "PERSON_CONTACT_PHONE"]]
    }
  },
  "hints": {
    "uncertain": {
      "person": {
        "contact": {
          "email": "jan.kowalski@email.com",
          "phone": "+4811111111"
        }
      }
    }
  }
}
