{
  "userKey": "7dfb9ded-c38f-49ae-95e2-307283a0b1f6",
  "returnUrl": "https://authologic.com/tests/return/?conversation={conversationId}",
  "strategy": "public:default",
  "query": {
    "identity": {
      "requireOneOf": [
        ["PERSON_NAME_FIRSTNAME", "PERSON_NAME_LASTNAME", "PERSON_IDS_NATIONAL_ID"],
        ["PERSON_NAME_FIRSTNAME", "PERSON_NAME_LASTNAME", "PERSON_IDS_PASSPORT_ID"]
      ],
      "optional": [
        {
          "list": ["PERSON_CONTACT_EMAIL"]
        }
      ]
    }
  }
}
