{
  "userKey": "7dfb9ded-c38f-49ae-95e2-307283a0b1f6",
  "returnUrl": "https://authologic.com/tests/return/?conversation={conversationId}",
  "callback": "https://system.acme.test/private/identity/{conversationId}/callback",
  "strategy": "public:default",
  "query": {
    "identity": {
      "requireOneOf": [["PERSON_NAME_FIRSTNAME", "PERSON_NAME_LASTNAME"]],
      "optional": [
        {
          "list": ["PERSON_NAME_FIRSTNAME", "PERSON_NAME_LASTNAME"]
        }
      ]
    },
    "verify": {
      "user": {
        "company": {
          "name": {
            "name": "ACME Inc."
          },
          "ids": {
            "taxId": "1234567890",
            "additionalId": "0987654321"
          },
          "address": {
            "text": "ul. Wiśniowa 133/20 00-950 Warszawa PL",
            "addressLine": "ul. Wiśniowa 133/20",
            "postalCode": "00-950",
            "city": "Warszawa"
          },
          "contact": {
            "email": "jan.kowalski@email.com",
            "phone": "+48692887345"
          }
        },
        "person": {
          "name": {
            "firstName": "Jan",
            "lastName": "Kowalski",
            "middleName": "Stanisław",
            "middleInitial": "S",
            "fullName": "Jan Stanisław Kowalski"
          },
          "ids": {
            "nationalId": "73121243192",
            "idCard": {
              "id": "ABC 12343",
              "issueDate": "2020-11-13",
              "expiryDate": "2020-11-13",
              "issueCountry": "PL"
            },
            "passport": {
              "id": "AD 24243423",
              "issueDate": "2020-11-13",
              "expiryDate": "2020-11-13",
              "issueCountry": "PL"
            },
            "driverLicence": {
              "id": "AA 12343454",
              "issueDate": "2020-11-13",
              "expiryDate": "2020-11-13",
              "issueCountry": "PL"
            },
            "residencePermit": {
              "id": "ZZ 12343454",
              "issueDate": "2020-11-13",
              "expiryDate": "2023-11-13",
              "issueCountry": "PL"
            },
            "otherDocument": {
              "id": "AA 12343454",
              "description": "Document ID.",
              "issueDate": "2022-05-30",
              "expiryDate": "2022-05-30",
              "issueCountry": "GB"
            },
            "accounts": [
              {
                "swiftbic": "BREXPLPW",
                "iban": "PL27114020040000300201355387",
                "currency": "PLN"
              }
            ],
            "cryptoWalletAddresses": [
              {
                "address": "0x3199962acffF2cD9f4a180D53Ddfa36f39F1A432",
                "chainId": "137",
                "name": "matic"
              }
            ]
          },
          "info": {
            "gender": "MALE",
            "nationality": "PL",
            "birthDate": "2020-11-13",
            "birthCity": "Gdańsk"
          },
          "address": {
            "text": "ul. Wiśniowa 133/20 00-950 Warszawa PL",
            "addressLine": "ul. Wiśniowa 133/20",
            "postalCode": "00-950",
            "city": "Warszawa"
          },
          "contact": {
            "email": "jan.kowalski@email.com",
            "phone": "+48692887345"
          }
        }
      }
    },
    "bankTransactions": {
      "type": "ALL",
      "flags": ["INCLUDE_SCHEDULED", "INCLUDE_TAGS"]
    }
  },
  "hints": {
    "userType": "PERSON",
    "known": {
      "company": {
        "name": {
          "name": "ACME Inc."
        },
        "ids": {
          "taxId": "1234567890",
          "additionalId": "0987654321"
        },
        "address": {
          "text": "ul. Wiśniowa 133/20 00-950 Warszawa PL",
          "addressLine": "ul. Wiśniowa 133/20",
          "postalCode": "00-950",
          "city": "Warszawa"
        },
        "contact": {
          "email": "jan.kowalski@email.com",
          "phone": "+48692887345"
        }
      },
      "person": {
        "name": {
          "firstName": "Jan",
          "lastName": "Kowalski",
          "middleName": "Stanisław",
          "middleInitial": "S",
          "fullName": "Jan Stanisław Kowalski"
        },
        "ids": {
          "nationalId": "73121243192",
          "idCard": {
            "id": "ABC 12343",
            "issueDate": "2020-11-13",
            "expiryDate": "2020-11-13",
            "issueCountry": "PL"
          },
          "passport": {
            "id": "AD 24243423",
            "issueDate": "2020-11-13",
            "expiryDate": "2020-11-13",
            "issueCountry": "PL"
          },
          "driverLicence": {
            "id": "AA 12343454",
            "issueDate": "2020-11-13",
            "expiryDate": "2020-11-13",
            "issueCountry": "PL"
          },
          "residencePermit": {
            "id": "ZZ 12343454",
            "issueDate": "2021-11-13",
            "expiryDate": "2023-11-13",
            "issueCountry": "PL"
          },
          "otherDocument": {
            "id": "AA 12343454",
            "description": "Document ID.",
            "issueDate": "2022-05-30",
            "expiryDate": "2022-05-30",
            "issueCountry": "GB"
          },
          "accounts": [
            {
              "swiftbic": "BREXPLPW",
              "iban": "PL27114020040000300201355387",
              "currency": "PLN"
            }
          ],
          "cryptoWalletAddresses": [
            {
              "address": "0x3199962acffF2cD9f4a180D53Ddfa36f39F1A432",
              "chainId": "137",
              "name": "matic"
            }
          ]
        },
        "info": {
          "gender": "MALE",
          "nationality": "PL",
          "birthDate": "2020-11-13",
          "birthCity": "Gdańsk"
        },
        "address": {
          "text": "ul. Wiśniowa 133/20 00-950 Warszawa PL",
          "addressLine": "ul. Wiśniowa 133/20",
          "postalCode": "00-950",
          "city": "Warszawa"
        },
        "contact": {
          "email": "jan.kowalski@email.com",
          "phone": "+48692887345"
        }
      }
    },
    "uncertain": {
      "company": {
        "name": {
          "name": "ACME Inc."
        },
        "ids": {
          "taxId": "1234567890",
          "additionalId": "0987654321"
        },
        "address": {
          "text": "ul. Wiśniowa 133/20 00-950 Warszawa PL",
          "addressLine": "ul. Wiśniowa 133/20",
          "postalCode": "00-950",
          "city": "Warszawa"
        },
        "contact": {
          "email": "jan.kowalski@email.com",
          "phone": "+48692887345"
        }
      },
      "person": {
        "name": {
          "firstName": "Jan",
          "lastName": "Kowalski",
          "middleInitial": "S",
          "fullName": "Jan Stanisław Kowalski"
        },
        "ids": {
          "nationalId": "73121243192",
          "accounts": [
            {
              "swiftbic": "BREXPLPW",
              "iban": "PL27114020040000300201355387",
              "currency": "PLN"
            }
          ],
          "cryptoWalletAddresses": [
            {
              "address": "0x3199962acffF2cD9f4a180D53Ddfa36f39F1A432",
              "chainId": "137",
              "name": "matic"
            }
          ]
        },
        "address": {
          "text": "ul. Wiśniowa 133/20 00-950 Warszawa PL",
          "addressLine": "ul. Wiśniowa 133/20",
          "postalCode": "00-950",
          "city": "Warszawa"
        },
        "contact": {
          "email": "jan.kowalski@email.com",
          "phone": "+48692887345"
        }
      }
    }
  }
}
