{
  "userKey": "7dfb9ded-c38f-49ae-95e2-307283a0b1f6",
  "returnUrl": "https://authologic.com/tests/return/?conversation={conversationId}",
  "callback": "https://system.acme.test/private/identity/{conversationId}/callback",
  "strategy": "public:mme",
  "query": {
    "identity": {
      "requireOneOf": [
        [
          "PERSON_NAME_FIRSTNAME",
          "PERSON_NAME_LASTNAME",
          "PERSON_INFO_BIRTHDATE",
          "PERSON_INFO_NATIONALITY"
        ]
      ]
    },
    "aml": {
      "checks": ["PEP"]
    }
  }
}
