{
  "userKey": "7dfb9ded-c38f-49ae-95e2-307283a0b1f6",
  "returnUrl": "https://authologic.com/tests/return/?conversation={conversationId}",
  "callback": "https://system.acme.test/private/identity/{conversationId}/callback",
  "strategy": "public:sss",
  "query": {
    "identity": {
      "requireOneOf": [
        [
          "PERSON_NAME_FIRSTNAME",
          "PERSON_NAME_LASTNAME",
          "PERSON_IDS_NATIONAL_ID",
          "PERSON_INFO_BIRTHDATE"
        ]
      ],
      "optional": [
        {
          "list": [
            "PERSON_IDS_IDCARD_ID",
            "PERSON_IDS_IDCARD_ISSUE_DATE",
            "PERSON_IDS_IDCARD_EXPIRY_DATE",
            "PERSON_IDS_IDCARD_ISSUE_COUNTRY",
            "PERSON_IDS_PASSPORT_ID",
            "PERSON_IDS_PASSPORT_ISSUE_DATE",
            "PERSON_IDS_PASSPORT_EXPIRY_DATE",
            "PERSON_IDS_PASSPORT_ISSUE_COUNTRY",
            "PERSON_IDS_DRIVER_LICENCE_ID",
            "PERSON_IDS_DRIVER_LICENCE_ISSUE_DATE",
            "PERSON_IDS_DRIVER_LICENCE_EXPIRY_DATE",
            "PERSON_IDS_DRIVER_LICENCE_ISSUE_COUNTRY",
            "PERSON_IDS_RESIDENCE_PERMIT_ID",
            "PERSON_IDS_RESIDENCE_PERMIT_ISSUE_DATE",
            "PERSON_IDS_RESIDENCE_PERMIT_EXPIRY_DATE",
            "PERSON_IDS_RESIDENCE_PERMIT_ISSUE_COUNTRY",
            "PERSON_INFO_GENDER",
            "PERSON_INFO_NATIONALITY",
            "PERSON_INFO_BIRTH_CITY"
          ]
        }
      ]
    }
  }
}
